{
  "@metadata": {
    "lastModified": "2025-09-30T13:52:31.987Z",
    "schemaVersion": "1"
  },
  "electron_config": "Kr 4d[10] 5s[2] 5p[5]",
  "ionization": {
    "unit": "eV",
    "values": [
      10.45126,
      19.13126,
      29.57,
      40.357,
      51.52,
      74.4,
      87.61
    ]
  },
  "mass": {
    "atomic_mass": {
      "unit": "u",
      "value": 126.904473
    },
    "standard_atomic_weight": {
      "deviation": 0.00003,
      "value": 126.90447
    }
  },
  "radius": {
    "calculated": {
      "unit": "pm",
      "value": 115
    },
    "covalent": {
      "deviation": 3,
      "unit": "pm",
      "value": 139
    },
    "empirical": {
      "unit": "pm",
      "value": 140
    },
    "vdw": {
      "unit": "pm",
      "value": 198
    }
  },
  "shell": [
    2,
    8,
    18,
    18,
    7
  ]
}
