{
  "@metadata": {
    "lastModified": "2025-09-30T13:52:31.987Z",
    "schemaVersion": "1"
  },
  "electron_config": "Ne 3s[2] 3p[1]",
  "ionization": {
    "unit": "eV",
    "values": [
      5.985769,
      18.82855,
      28.447642,
      119.9924,
      153.8252
    ]
  },
  "mass": {
    "atomic_mass": {
      "unit": "u",
      "value": 26.98153857
    },
    "standard_atomic_weight": {
      "deviation": 3e-7,
      "value": 26.9815384
    }
  },
  "radius": {
    "calculated": {
      "unit": "pm",
      "value": 118
    },
    "covalent": {
      "deviation": 4,
      "unit": "pm",
      "value": 121
    },
    "empirical": {
      "unit": "pm",
      "value": 143
    },
    "vdw": {
      "unit": "pm",
      "value": 184
    }
  },
  "shell": [
    2,
    8,
    3
  ]
}
